{
  "$schema": "https://json-schema.org/draft/2020-12/schema",
  "$id": "https://openvaluesstandard.org/schema/value-editorial-v0.4.schema.json",
  "title": "Open Values Value Editorial v0.4",
  "description": "The sourced explanations shown on each value's page, such as Organic or Repairability: what the value requires, who checks it, where it stops and how the site uses it in scores. Conscious Consuming keeps it.",
  "type": "object",
  "additionalProperties": false,
  "required": ["format", "version", "updated", "state", "purpose", "renderRule", "requiredValues", "pilotValues", "entries"],
  "properties": {
    "format": { "const": "open-values-value-editorial", "description": "Always \"open-values-value-editorial\". Tells a reader that this file holds the explanations shown on value pages." },
    "version": { "type": "string", "pattern": "^0\\.4\\.0(?:[-+].*)?$", "description": "The version of this file's format, 0.4.0." },
    "updated": { "type": "string", "pattern": "^\\d{4}-\\d{2}-\\d{2}$", "description": "The day the file was last changed, as YYYY-MM-DD." },
    "state": { "const": "environmental-durability-batch", "description": "Which batch of writing the file holds. Always \"environmental-durability-batch\" in this version." },
    "purpose": { "$ref": "#/$defs/nonEmptyString", "description": "One or two sentences saying what the file is for." },
    "renderRule": { "$ref": "#/$defs/nonEmptyString", "description": "The rule the app follows when showing entries: which entries may be shown, and what to show for a value that has none." },
    "requiredValues": {
      "type": "array",
      "minItems": 15,
      "maxItems": 15,
      "uniqueItems": true,
      "items": { "$ref": "#/$defs/key" },
      "description": "The keys of the fifteen values that have a page in the app, in the app's order. Every one must have an entry."
    },
    "pilotValues": {
      "type": "array",
      "minItems": 5,
      "maxItems": 5,
      "uniqueItems": true,
      "items": { "$ref": "#/$defs/key" },
      "description": "The keys of the five values that were written first. They must stay in entries."
    },
    "entries": {
      "type": "object",
      "minProperties": 15,
      "maxProperties": 15,
      "additionalProperties": { "$ref": "#/$defs/entry" },
      "description": "One explanation for each value, keyed by the value's key, such as \"organic\"."
    }
  },
  "$defs": {
    "nonEmptyString": { "type": "string", "minLength": 1 },
    "key": { "type": "string", "pattern": "^[a-z][a-z0-9_]*$" },
    "claim": {
      "type": "object",
      "additionalProperties": false,
      "required": ["text", "sourceLabel", "source", "asOf"],
      "properties": {
        "text": { "type": "string", "minLength": 40, "maxLength": 520, "description": "The claim itself, as shown on the page, in 40 to 520 characters." },
        "sourceLabel": { "type": "string", "minLength": 5, "description": "The name of the source as shown on the page, such as the publisher and page title." },
        "source": { "type": "string", "pattern": "^https://", "description": "The web address of the source, starting with https://." },
        "asOf": { "type": "string", "pattern": "^\\d{4}-\\d{2}-\\d{2}$", "description": "The day the source was checked for this claim, as YYYY-MM-DD." }
      }
    },
    "section": {
      "type": "object",
      "additionalProperties": false,
      "required": ["id", "heading", "claims"],
      "properties": {
        "id": { "enum": ["requires", "evidence", "checked-by", "limits", "scoring"], "description": "Which part of the explanation this is: \"requires\" (what the value or label requires), \"evidence\" (what is looked for), \"checked-by\" (who checks it), \"limits\" (where it stops) or \"scoring\" (how the site reads it in scores)." },
        "heading": { "type": "string", "minLength": 8, "description": "The section heading as shown on the page, such as \"Who checks it\"." },
        "claims": {
          "type": "array",
          "minItems": 1,
          "maxItems": 2,
          "items": { "$ref": "#/$defs/claim" },
          "description": "One or two sourced claims that make up the section."
        }
      }
    },
    "entry": {
      "type": "object",
      "additionalProperties": false,
      "required": ["key", "label", "kind", "classification", "status", "summary", "sections"],
      "properties": {
        "key": { "$ref": "#/$defs/key", "description": "The value's key, the same as the entry's key in entries." },
        "label": { "$ref": "#/$defs/nonEmptyString", "description": "The value's name as shown to people, such as \"Organic\"." },
        "kind": { "enum": ["certified", "assessed"], "description": "\"certified\" when the value rests on a label or certification, \"assessed\" when it rests on researched judgement." },
        "classification": { "enum": ["certification-scheme", "assessed-value", "label-family", "ingredient-analysis", "mixed-methods"], "description": "What sort of evidence stands behind the value: a certification scheme, an assessed value, a family of labels, an ingredient analysis, or a mix of methods." },
        "status": { "const": "ready-for-founder-review", "description": "Always \"ready-for-founder-review\" in this version. The app shows only entries with this status." },
        "summary": { "type": "string", "minLength": 80, "maxLength": 300, "description": "Two or three sentences, 80 to 300 characters, saying what the value tells a reader and what it does not." },
        "sections": {
          "type": "array",
          "minItems": 4,
          "maxItems": 4,
          "items": { "$ref": "#/$defs/section" },
          "description": "The four parts of the explanation, each with a heading and sourced claims."
        }
      }
    }
  }
}
