{
  "format": "open-values-value-editorial",
  "version": "0.4.0",
  "updated": "2026-07-18",
  "state": "environmental-durability-batch",
  "purpose": "Sourced, claim-level explanatory copy for value pages. Computed category counts remain app-owned; this file explains what a value can and cannot support.",
  "renderRule": "Render only entries whose status is ready-for-founder-review. Keep the existing honesty block for every value without a ready entry.",
  "requiredValues": [
    "organic",
    "fair_trade",
    "rainforest_alliance",
    "vegan",
    "palm_oil",
    "cruelty_free",
    "privacy",
    "openness",
    "transparency",
    "repairability",
    "longevity",
    "durability",
    "packaging",
    "environment",
    "accessibility"
  ],
  "pilotValues": [
    "organic",
    "fair_trade",
    "rainforest_alliance",
    "privacy",
    "repairability"
  ],
  "entries": {
    "organic": {
      "key": "organic",
      "label": "Organic",
      "kind": "certified",
      "classification": "certification-scheme",
      "status": "ready-for-founder-review",
      "summary": "Organic is a regulated production label. It is useful evidence about how agricultural ingredients were produced and handled, not a verdict on health, labor, or the product's whole footprint.",
      "sections": [
        {
          "id": "requires",
          "heading": "What it requires",
          "claims": [
            {
              "text": "Under the USDA program, a packaged product labeled “organic” must contain at least 95% certified organic ingredients, excluding salt and water. Prohibited methods include genetic engineering, ionizing radiation, and sewage sludge; allowed and restricted inputs are set by regulation.",
              "sourceLabel": "USDA — Labeling Organic Products",
              "source": "https://www.ams.usda.gov/rules-regulations/organic/labeling",
              "asOf": "2026-07-18"
            }
          ]
        },
        {
          "id": "checked-by",
          "heading": "Who checks it",
          "claims": [
            {
              "text": "A USDA-accredited certifying agent reviews the operation, receives an on-site inspection report, and decides whether to certify it. Certified operations then go through annual review and inspection.",
              "sourceLabel": "USDA — Becoming a Certified Operation",
              "source": "https://www.ams.usda.gov/services/organic-certification/becoming-certified",
              "asOf": "2026-07-18"
            }
          ]
        },
        {
          "id": "limits",
          "heading": "Where it stops",
          "claims": [
            {
              "text": "The organic rules govern the organic production and labeling claim. Food carrying that claim still has to meet separate FDA food-labeling and safety rules, so the seal should not be read as a nutrition or food-safety grade.",
              "sourceLabel": "FDA — Organic on Food Labels",
              "source": "https://www.fda.gov/food/nutrition-food-labeling-and-critical-foods/organic-food-labels",
              "asOf": "2026-07-18"
            },
            {
              "text": "Fraud remains possible. USDA's 2024 enforcement report records investigations involving fraudulent certificates and sales by suspended operations; certification lowers uncertainty but does not remove the need for oversight.",
              "sourceLabel": "USDA — 2024 Organic Oversight and Enforcement Update",
              "source": "https://www.ams.usda.gov/sites/default/files/media/NOP2024SummaryofActivitiesReport.pdf",
              "asOf": "2026-07-18"
            }
          ]
        },
        {
          "id": "scoring",
          "heading": "How the commons reads it",
          "claims": [
            {
              "text": "In generated food decisions, this value records a recognized organic label in Open Food Facts. A matching label is presence evidence only; missing label data stays unknown, and the score does not infer wider virtue.",
              "sourceLabel": "Open Food Facts — Labels",
              "source": "https://world.openfoodfacts.org/labels",
              "asOf": "2026-07-18"
            }
          ]
        }
      ]
    },
    "fair_trade": {
      "key": "fair_trade",
      "label": "Fair trade",
      "kind": "certified",
      "classification": "certification-scheme",
      "status": "ready-for-founder-review",
      "summary": "Fairtrade is a supply-chain certification with social, economic, and environmental requirements. The mark is evidence that a covered chain was audited against a named standard, not proof of a particular income or labor outcome.",
      "sections": [
        {
          "id": "requires",
          "heading": "What it requires",
          "claims": [
            {
              "text": "Fairtrade standards apply to producer organizations and to traders in the chain. Their requirements cover social, economic, and environmental conditions; the applicable rules depend on the product and organization type.",
              "sourceLabel": "Fairtrade International — How certification works",
              "source": "https://www.fairtrade.net/en/why-fairtrade/how-we-do-it/how-does-the-label-work/how-fairtrade-certification-works.html",
              "asOf": "2026-07-18"
            }
          ]
        },
        {
          "id": "checked-by",
          "heading": "Who checks it",
          "claims": [
            {
              "text": "FLOCERT audits producer organizations and supply-chain actors against Fairtrade standards. Initial producer certification includes an on-site audit, and non-conformities have to be resolved before certification is issued.",
              "sourceLabel": "FLOCERT — How to get Fairtrade-certified",
              "source": "https://www.flocert.net/how-to-join-fairtrade/",
              "asOf": "2026-07-18"
            }
          ]
        },
        {
          "id": "limits",
          "heading": "Where it stops",
          "claims": [
            {
              "text": "Certification does not promise the same result everywhere. Fairtrade's review of 2015–2020 research found a mixture of consistent, mixed, and no effects across studied outcomes, including income and wages.",
              "sourceLabel": "Fairtrade International — Evidence map 2015–2020",
              "source": "https://www.fairtrade.net/content/dam/fairtrade/fairtrade-international/library/2022/exploring-fairtrade%27s-impact--a-review-of-research-on-fairtrade-from-2015-2020/Fairtrade_Evidence-mapping-full-report.pdf",
              "asOf": "2026-07-18"
            },
            {
              "text": "The mark applies to a certified product and covered chain. It should not be stretched into a judgment about every product, practice, or company under the same brand.",
              "sourceLabel": "Fairtrade International — How certification works",
              "source": "https://www.fairtrade.net/en/why-fairtrade/how-we-do-it/how-does-the-label-work/how-fairtrade-certification-works.html",
              "asOf": "2026-07-18"
            }
          ]
        },
        {
          "id": "scoring",
          "heading": "How the commons reads it",
          "claims": [
            {
              "text": "In the current coffee, chocolate, and tea decisions, this value records recognized fair-trade label tags from Open Food Facts. It scores declared certification presence, not the size of a premium or a measured producer outcome.",
              "sourceLabel": "Open Food Facts — Labels",
              "source": "https://world.openfoodfacts.org/labels",
              "asOf": "2026-07-18"
            }
          ]
        }
      ]
    },
    "rainforest_alliance": {
      "key": "rainforest_alliance",
      "label": "Rainforest Alliance",
      "kind": "certified",
      "classification": "certification-scheme",
      "status": "ready-for-founder-review",
      "summary": "Rainforest Alliance certification covers named farm and supply-chain requirements across environmental, social, and economic themes. The frog seal is a traceable standard claim, not a blanket guarantee that harm is absent.",
      "sections": [
        {
          "id": "requires",
          "heading": "What it requires",
          "claims": [
            {
              "text": "The Sustainable Agriculture certification program sets farm and supply-chain requirements spanning environmental protection, agricultural practices, livelihoods, and human rights. The exact obligations depend on the certificate holder and commodity scope.",
              "sourceLabel": "Rainforest Alliance — Certification Program",
              "source": "https://www.rainforest-alliance.org/for-business/certification/",
              "asOf": "2026-07-18"
            }
          ]
        },
        {
          "id": "checked-by",
          "heading": "Who checks it",
          "claims": [
            {
              "text": "Authorized certification bodies audit farms and supply-chain organizations against the applicable standard. Rainforest Alliance manages the assurance rules and authorization system; the audit decision is made by the certification body.",
              "sourceLabel": "Rainforest Alliance — 2020 Certification Program",
              "source": "https://www.rainforest-alliance.org/resource-item/terms-reference-rainforest-alliance-sustainable-agriculture-standard/",
              "asOf": "2026-07-18"
            }
          ]
        },
        {
          "id": "limits",
          "heading": "Where it stops",
          "claims": [
            {
              "text": "Audits can miss harm in long or weakly mapped chains. A 2023 Associated Press investigation traced cocoa from a protected Nigerian conservation zone to facilities of licensed traders; Rainforest Alliance pointed to incomplete mapping and regulatory gaps in the country.",